"Eengang da han gik i en meget behagelig Skov, som ikke laae langt fra Havet, kom han til en gammel ærværdig Mand, som laae nedsynket i en dyb Kummer, nær ved en Kilde.",edmunds_rejse_a
"Hans Klæder viiste, at han var en af de Ulykkelige, som paa dette Sted blev dreven Handel med, og som vi kalder Slaver.",edmunds_rejse_a
"Næst ved ham laae en visnet Blomsterkrands, hvilken den Gamle nu og da tog i Haanden, saae den mellemstunder med et bedrøvet Aasyn an, og lod undertiden Taare nedtrille paa den.",edmunds_rejse_a
Den unge Engelænder blev rørt af dette Syn og bevæget til at gaae hen til ham.,edmunds_rejse_a
"Han hilsede ham meget venlig, satte sig fortrolig ned hos ham, og spurte ham om Aarsagen til hans Bedrøvelse.",edmunds_rejse_a
"Den Gamle sukkede, saae med et væmodigt Øie paa den unge Fremmede og sagde: te Forlang ikke at jeg skal fortælle dig min Hi i storie; thi dersom du har et Hierte, som jeg, og kunde føle hvad jeg har følt, saa spurte du ikke med saa glad en Mine.",edmunds_rejse_a